{"created_at":"2025-09-08T19:38:40+08:00","intent_type":"scaling","namespace":"test","priority":5,"reason":"Rule-based intent: scale default-workload to 5 replicas in test namespace (from: {\"intent_type\": \"scaling\", \"target\": \"test-deployment\", \"namespace\": \"default\", \"replicas\": 5, \"source\": \"user\", \"status\": \"pending\", \"target_resources\": [\"deployment/test-deployment\"]})","replicas":5,"source":"test","status":"pending","target":"default-workload","updated_at":"2025-09-08T19:38:40+08:00"}